row_id,imdb_review_id,review_title,review_text,review_date,review_date_raw,movie_review_score,helpful_up,helpful_down,helpful_net,username,spoiler_collapsed_in_source_file,review_text_available,review_word_count,permalink
157,rw1979438,"Sometimes unsurprisingly cheesy, but an overall impressive Christmas comedy","I have now seen a bunch of movies starring former ""Saturday Night Live"" comedian Will Ferrell, but it took me a while to get around to seeing this one, even though I have now been aware of its existence for probably about three years. It's getting to be that time of year again, and just yesterday, I finally rented ""Elf"", not exactly sure how impressed I would be. It could have easily turned out to be yet another cheesy, boring family movie from recent years, but while it may seem like that at times, it usually isn't. It's sometimes cheesy, and certainly not consistently hilarious, but I'm still impressed. One Christmas Eve, a baby boy at an orphanage is placed in his crib shortly before Santa comes. When Santa is not looking, the baby crawls into his sack and stows away to the North Pole, which is where he's finally discovered in that sack! The elves name him Buddy, after the label on his diaper, and Papa Elf volunteers to raise him. So, Buddy grows up at the North Pole, living the life of an elf, and still thinking he's one of them, even though he's a lot bigger than the others, and can't make toys nearly as fast as them. After finally finding out that he's actually a human, he learns about his real father, Walter Hobbs, who is a children's book publishing executive in New York, and doesn't even know Buddy was born! Buddy learns from Santa that Walter is on his naughty list, due to his selfishness, and the human raised by elves sets out to New York to find his father and change him. Obviously, this won't be easy, and it doesn't help that Buddy has never experienced the human world that awaits. The film starts out with an opening narration from Papa Elf, which certainly isn't the best part, and the segment where he says how trolls once worked for Santa, but they weren't toilet trained, showing an example with a troll in a diaper, may suggest the film is going to be another cheap gross-out comedy for kids. But hey, not so fast! The vast majority of the film is definitely NOT like that! I got some BIG laughs out of this movie, I think starting with some of the gags that involve Buddy's life as a grown human at the North Pole. I definitely laughed pretty hard when the main character meets a raccoon on his way to New York and tries to be affectionate with it! After he arrives in the city, the things he does there, being unfamiliar with life in a community like this, a lot different from the North Pole, are also good for laughs. Some of the gags I didn't care much for, including Buddy spinning around in a revolving door until he throws up in a garbage can, but for the most part, Will Ferrell's antics in the lead role didn't fail to amuse me. Interesting story as well. Being about Santa and his elves at the North Pole, one might think ""Elf"" is strictly for kids, and I guess I thought that might be the case. However, overall, I would say it has enough to please both child and adult viewers, not ALL of them of course (it's obviously not for the many Will Ferrell haters out there), but a lot of them. Now, there are obvious reasons why this movie is rated PG, a great example being Jovie (an employee at Gimbels, a clothing store in New York) singing in the shower, and Buddy coming into the restroom to sing along, not realizing she's naked! I found this to be another comedic highlight in the film, but parents might want to be cautious. Anyway, while this movie clearly isn't perfectly clean family fun, I would say it's close enough to it, and a lot better than the last Christmas movie I watched, ""Deck the Halls"", that's for sure",2008-11-22,"Nov 22, 2008",7.0,1,1,0,Beta_Gallinger,False,True,664,https://www.imdb.com/title/tt0319343/review/rw1979438/?ref_=tturv_perm_157
158,rw0997635,zero stars,"Being an American entails watching people robotically tell themselves they like something that a marketing dept told them they like, and/or insisting there are laughs in the last few horrible Will Ferrell vehicles. The bits here are strenuously unfunny. The movie is a schlocky piece of garbage lifting garbage-y ideas from other garbage-y movies. This movie doesn't have an inch of redeeming celluloid. Every copy of it should be collected and dumped into some live volcano. Then we should all pity the volcano... Favreau made it for his adolescent daughter. It is over-ripe maudlin, sentiment that stinks worse than the dirty diaper you stepped in, in the Red Lobster parking lot last week. Zooey Deschanel gives Diane Keaton a run for her money in the ""actresses who should never be allowed to sing... EVER"" sweepstakes. This is dreck.",2005-01-12,"Jan 12, 2005",1.0,29,58,-29,onepotato2,False,True,142,https://www.imdb.com/title/tt0319343/review/rw0997635/?ref_=tturv_perm_158
159,rw10198656,A Generous dose of Christmas spirit.,"30 Years ago Buddy became the first human to set foot in Santa's workshop. In an orphanage, Buddy was just a baby when he sneaked into Santa's sack. Santa decided to raise him as an Elf. Buddy (Will Ferrell) always believed he was an Elf, just much bigger than the others. When he overhears elves calling him a human, Papa Elf confirms Buddy's fears. His mother has long since passed away, but his biological father lives in New York. And so Buddy embarks on a journey to the city. Buddy's father is publisher Walter Hobbs (James Caan), and happens to be on Santa's naughty list. When Buddy finally convinces Walter he is indeed his son, Walter lets him stay with him. But with Buddy unaccustomed to city life - and with the mind of a child - this proves to be no easy task. Plenty misadventures and funny moments ensue. Although 'Elf' is indeed slapstick as expected, I surprisingly enjoyed it more than anticipated, and there were indeed many truly funny moments. I thought Will Ferrell was perfectly cast as Buddy, the Elf.",2024-12-17,"Dec 17, 2024",6.0,1,1,0,paulclaassen,False,True,181,https://www.imdb.com/title/tt0319343/review/rw10198656/?ref_=tturv_perm_159
160,rw7058455,"""He's A Fake!"" But The Excitement Is Very Real!","I love everything about elf, the story, the comedy; the Christmas everything about this is entertaining to the point it becomes a Christmas tradition to watch it. Will Ferrell is without a doubt one of the funniest comedians I've had the pleasure of watching, in this he plays Buddy the elf, a baby who was found in Santa's sack when he got back to the North Pole, that alone makes the story interesting and even more so we get to see an elf go to New York, a human sized elf that is. Its a very funny movie that is sure to keep you entertained and in stitches, I really enjoyed it and i think everyone else will, truly remarkable! Highly recommend!",2021-06-24,"Jun 24, 2021",9.0,3,1,2,Branz_Reviews,False,True,122,https://www.imdb.com/title/tt0319343/review/rw7058455/?ref_=tturv_perm_160
161,rw2535107,"Not excellent, but a wonderful Christmas comedy nonetheless","Before his first debut in the superhero genre starting with the first two Iron Man films, he directs a Christmas comedy known as ""Elf"" starring Will Ferrell and James Caan. It's about one of Santa's elves named Buddy who learns of his identity as a human and goes to New York City to find/meet his father and teach him the true meaning of Christmas in world of wacky cynics. As far as Christmas movies go, this one successfully details the Christmas feeling quite perfectly. The actors are brilliant. James Caan did a good job as Buddy's father, but I think that the best performance goes to Will Ferrell for his portrayal as Buddy and successfully gives out his hilarious comedic moments. The rest weren't that bad either especially Bob Newhart, Mary Steenburgen and Ed Asner. The jokes in this movie are hilarious including the ""He's an angry elf"" part and the directing from Jon Favreau was surprisingly good. My biggest complaint about this movie was the ending which felt too cheesy for my taste and in the third act, there were barely any jokes near the end of the film including it's atrocious dialogue, but I think the story was wonderful that boosts up the character development and it's not a complaint. Elf may not be excellent, but I'm sure it would be known to fans of Jon Favreau as a Christmas classic for children young and old. 7.6/10",2011-12-20,"Dec 20, 2011",7.0,1,1,0,gavin-thelordofthefu-48-460297,False,True,242,https://www.imdb.com/title/tt0319343/review/rw2535107/?ref_=tturv_perm_161
162,rw7657739,"Cute, funny holiday classic of a grown up being a kid at heart!","Finally after all these years saw the now Christmas classic ""Elf"", and I must say it was funny and enjoyable actually sentimental. As the story is well done and it gets one in the holiday mood for the meaning of Christmas. Buddy(in a funny turn from Will Ferrell) is an orphaned little baby who ends up in the North Pole to be raised by a lead elf(Bob Newhart) and he loves it up only when grown like an adult he needs a change so he decides to travel back to earth and find his real dad in New York City. And Buddy loves and lives it up only to find that real daddy is cold and tough(James Caan) he's not really a Christmas or holiday guy. Yet Buddy meets Jovie(the young and perhaps first film appearance from the sexy Zooey Deschanel) and she's a department store elf who has talent that being of a great singing voice. Thru it all Buddy learns life with a new family as magic and fate help bring out the spirit of Christmas. Overall fine and funny Christmas film memorable for Ferrell's funny turn as his adult elf is a kid at heart and the talent of the sexy Deschanel was well on display making this movie a must watch.",2021-12-18,"Dec 18, 2021",8.0,3,1,2,blanbrn,False,True,219,https://www.imdb.com/title/tt0319343/review/rw7657739/?ref_=tturv_perm_162
163,rw2173688,Your very good elf...,"A delightful Christmas fantasy for all the family, proof that latter-day Hollywood can still knock out a charming festive film, just like in the old days. Sharing with the classic ""Miracle on 34th Street"" its New York department store setting, the story here is as improbable as any you'll encounter on any Feast of Stephen you care to mention. But forget that and just enjoy Will Ferrell accomplishing a wide-eyed but never over-played naiveté rarely seen since Jimmy Stewart in ""Harvey"" as the innocent elf (actually a human baby born out of wedlock) abroad, attempting to bond with his curmudgeonly old dad this particular Christmas (of course!). Thus Buddy's many humorous adventures and encounters with the people, sights and sounds of New York naturally take us on an emotional roller-coaster ride but by the end of the movie, as if you didn't know, he's gotten a pretty co-worker (the wonderfully named Zooey Deschanel) to fall in love with him, made up big-time with his dad and just for good measure restored Christmas spirit to all and sundry in a nice, even exciting conclusion, which gives us the memorable sight of Santa's sleigh taking off over Central Park so that old Saint Nick can get on with his naughty or nice list. The casting is very good, James Caan, like fellow 70's tough guy De Niro before him, adapting neatly to family comedy, with in support, the ever-lovely Mary Steenburgen as his too-good-for-him wife and old MTM stalwarts Bob Newhart and Ed Asner, even more improbably as Buddy's adopted elf-father and Santa Claus respectively. Ferrell makes the film though, his wide-eyed wonder infectious right from the outset. The only real drawback for me really was the too-obvious product placement inserts. Otherwise, the film stays away from maudlin sentimentality particularly in its treatment of children and is filled with uplifting Christmas music, settings and spirit, rarely stooping to vulgarity for its laughs (okay, we do get a couple of near-obligatory flatulence and burping jokes, but that's okay, kids love 'em!). I heartily recommend anyone in need of a Christmas tonic to watch ""Elf"" and bring out your inner-child.",2009-12-14,"Dec 14, 2009",7.0,1,1,0,Lejink,False,True,371,https://www.imdb.com/title/tt0319343/review/rw2173688/?ref_=tturv_perm_163
164,rw9516453,A Surprisingly Christmas Movie Turned Into an All Time Holiday Classic,"This movie has turned into such an awesome holiday classic of all times now. Will Ferrell is an absolute genius in his ability to bring such warmth, humor, love, belonging, and unique character to this movie. That's what made it such a classic. Will and Faizon love were perfect in the rolls they played in each scene. The innocence of youth longing to love and be loved is something else Will brings to the scene in such a unique way in his ability to capture the hope in everyone's heart. That hope is a reality that comes to life during the holiday season with family, relatives, extended family, and special long time relationships with friends.",2023-12-25,"Dec 25, 2023",10.0,3,1,2,sharlhill,False,True,115,https://www.imdb.com/title/tt0319343/review/rw9516453/?ref_=tturv_perm_164
166,rw8771910,Christmas Fuel,"I knew the poster for this movie for a long time. I knew there was such a movie, but I wasn't curious. I wanted to watch it on New Year's Eve. This year i mean. I'm also really surprised that it's directed by John Favreau. It's also really weird to see Zooey Deschanel blonde, but she is so beautiful. I really liked the acting. I was also expecting the movie as a annoying comedy movie. But it was a better movie than I thought. It's a family movie. I like it. Also, I think it has become one of the classics during Christmas movies. Yes, it's a kids movie, but I love watching these kinds of movies on New Year's Eve . . .",2023-01-01,"Jan 1, 2023",8.0,3,1,2,jack_hasanov,False,True,121,https://www.imdb.com/title/tt0319343/review/rw8771910/?ref_=tturv_perm_166
167,rw6402807,it is so sweet,I like this movie and it is sweet. It is a good Christmas movie. there is creepy parts and scary parts and it makes you cry a lot. but it is also so funny but lots of parts in it feel boring. It is to grown up to and it is a old movie. But the story is really nice and the singing! It is a good movie I hope you like it.,2020-12-26,"Dec 26, 2020",7.0,1,1,0,kyleesky,False,True,73,https://www.imdb.com/title/tt0319343/review/rw6402807/?ref_=tturv_perm_167
168,rw2915285,"Unwatchable, just not good at all, very boring","""Elf"" is a very boring movie. Will Farrel has no talent. Did this movie even have a script? If so, did anyone read it? Why is no talent John Favreu directing a movie? Someone paid a lot of money to make this movie, the money would have been better spent feeding homeless people. I know bad movies exist, I get it, what I don't understand is the recent phenomenon of how a piece of crap like ""Elf"" and many other bad movies can actually make a profit and how people tell you how much they love these movies that you know without a doubt totally suck. I miss the old days when bad movies would just totally flop and die. If people keep seeing bad movies Hollywood will keep making them. Please stop spending money on bad movies and force Hollywood to make good movies, I like good movies and refuse to watch garbage. ""Elf"" is pure garbage.",2013-12-02,"Dec 2, 2013",1.0,19,34,-15,jamescg975,False,True,158,https://www.imdb.com/title/tt0319343/review/rw2915285/?ref_=tturv_perm_168
169,rw1784978,Spagetti Syrup And Gingerbread Men,"Will Farrell has done better films than this one but this is a warm feel good holiday film. When you look at it as a whole film, it holds a certain charm. That charm is established by framing the story around belief in the fantasy known as Christmas. This is the most extensive work done by Bob Newhart since the 1990's. Bob is the framework that holds this story together. Ed Asner has a very small role as Santa & is just here enough to be recognizable having little chance to do much acting. Brunette bomb shell Zooey Deschannel is charming as a blonde & proves she can sing. Hopefully she will get some better roles as her young career has proved she can handle them. In this movie, she makes the viewer buy that young innocent charm as she glows here. Faizon Love is excellent in support as the Gimbles store manager. James Caan is OK here, less annoying than in some films, but for some reason he does not seem to get really good roles anymore. There are some gross holiday bits, like downing a 2 liter Coke & a 5 minute belch which is entirely logical, and then some bits which are funny physical comedy. Farrell does not carry the whole show here and that is a good thing. While he is considered the star of his films, his films are better when the support can carry them. His easily worst film is Bewitched where he tried to carry the entire film & flopped badly. This doesn't measure up to classic holiday films but is better than some of the lame efforts of recent years.",2007-12-22,"Dec 22, 2007",6.0,1,1,0,DKosty123,False,True,274,https://www.imdb.com/title/tt0319343/review/rw1784978/?ref_=tturv_perm_169
170,rw5086550,Funny and sweet Xmas flick,"Ingenious, very funny movie about a human adopted by Santa who travels to New York. This very sweet little movie is powered by Will Farrell as the goofy almost-elf; Zooey Deschanel gives a rare non-manic-pixie performance as a suspicious store worker. Perfect Christmas fare.",2019-08-29,"Aug 29, 2019",8.0,3,1,2,cherold,False,True,47,https://www.imdb.com/title/tt0319343/review/rw5086550/?ref_=tturv_perm_170
172,rw3588025,Wacky Spiritual Successor to the Tacky Holiday Tales of Yore,"A great excuse for Will Ferrell to run around in holiday garb, drawing sidelong glances from the sidewalk-strollers of Manhattan. Ferrell is the ultimate man-child, a six-and-a-half foot mess of arms and legs in green tights, buckled shoes and a pointy hat, matching the elvish wardrobe of 1964's Rudolph the Red-Nosed Reindeer. As physical comedy and ridiculous enthusiasm is his forte, Elf makes for an excellent vehicle, but it's also loaded with a swath of supporting talent (admittedly, another of the comedian's calling cards). Zooey Deschanel (somewhat unrecognizable in blonde hair) is a good fit as his skeptical, frayed love interest, but the best work comes from James Caan, Peter Dinklage, Amy Sedaris, Andy Richter, Kyle Gass and especially Bob Newhart as his sweet, yet long-suffering, adoptive father on the North Pole. Genuinely funny, warm, sugary and spirited; an unexpectedly effective successor to the Christmas classics it seemingly sets out to roast. Worth adding to the annual rotation.",2016-11-28,"Nov 28, 2016",8.0,3,1,2,drqshadow-reviews,False,True,165,https://www.imdb.com/title/tt0319343/review/rw3588025/?ref_=tturv_perm_172
173,rw7662544,A Will Ferrell Christmas Story,"Elf is considered an American Christmas classic and it is a film that has a charm to it. Will Ferrell doing what he does well, play a giant man-child which well works well in Elf because he was so innocent. There was an attempt at a heartfelt story with Buddy (Ferrell) trying to bond with his biological dad (James Caan) despite his dad not wanting to know. However, the comedy depends on how much you like Ferrell's style of comedy. I do like the ending because it does have a warm fuzzy feeling when the public by Central Park starts singing Christmas Carols and a Christmas choir singing when Santa appears before the public.",2021-12-19,"Dec 19, 2021",6.0,1,1,0,freemantle_uk,False,True,115,https://www.imdb.com/title/tt0319343/review/rw7662544/?ref_=tturv_perm_173
174,rw2534123,A rarity for the holidays and for Ferrell,"Elf has the premise and the look of a badly made Christmas special made solely for network TV. Going into this with mediocre expectations, it only took about ten minutes of seeing Will Ferrell in an elf costume to know that my predictions were dreadfully wrong. This wasn't a case of holiday dreck, but a case of the Christmas film that combined heart, soul, wit, and laughs into a beautiful holiday parable. The story is about Buddy the Elf (Ferrell) who accidentally crawled into Santa's sack at the orphanage when he was an infant and gets taken back to the North Pole. Santa Claus and the elves choose to raise him and train him to become an elf. Buddy is of course a human so he grows a lot faster than the average elf. In fact, he towers over every other elf he works with, and this leads to problems when he is older. Buddy then learns he is a human, which causes confusion and sadness. It is told that he was placed in that orphanage as an infant because his father fell in love with a woman who gave birth to him then gave him up unbeknownst to him. Buddy then decides he will go to New York City to try and find his dad and reconnect with him. His goal is to also spread Christmas cheer far and wide because Santa's sleigh is almost forced to operate with an engine. In the olden days, Santa's sleigh could fly because of mass amounts of Christmas spirit and children believing in Santa Claus. Now, he has to resort to heavy machinery to do that job. Will Ferrell hasn't sat right with me for the longest time, but as I see more of his movies I begin to like the guy in a sense where I'd like to see him do one of two movies; (a) heartfelt children's' films or (2) very serious dramas in the vein of his 2011 film Everything Must Go. He doesn't have the talents to pull off incredibly funny slapstick because his schtick is usually composed of running around like a towering dork or just screaming. Elf shows his ability to incorporate his persona in a character you can't help but love. We also see Zooey Deschannel, one of my favorite females in the business today, as Jovie, a woman who works at a mall as Santa's little helpers. Buddy falls for Jovie in a sort of non-conventional way, but he winds up getting conventional help from his younger brother Michael (Tay). Elf is more than holiday fluff, it's a successful romp of Christmas spirit sealed inside a good family film. The cast is lively, the antics aren't over the top, and the storyline unique and film sustainable. This also shows immensely that director Jon Favreau can be handed a script for a thriller, a comedy, a romantic comedy, a superhero film, or a drama and still be able to create on screen magic. I'm also sure this beats a movie about elves working in a tree during the dry season. Starring: Will Ferrell, James Cann, Zooey Deschannel, and Daniel Tay. Directed by: Jon Favreau.",2011-12-18,"Dec 18, 2011",8.0,3,1,2,StevePulaski,False,True,530,https://www.imdb.com/title/tt0319343/review/rw2534123/?ref_=tturv_perm_174
175,rw1956257,Really nice movie,"When i first thought about seeing this film, I was expected it to be some cheesy Christmas movie where Will Ferrell acts like an idiot but i was pretty wrong. Will Ferrell's character is a 30 year elf and he acts as if he hasn't seen humans..Although some of his acting is a little over the top he plays his character well. But other than that, the movie is a really nice Christmas movie. Its a classic Christmas story. In the beginning it starts out a little boring but then it picks up the pace and the movie gets more interesting. It starts better when Buddy (Will Ferrell) goes and moves out of his elf home and decides to find he's real dad in New York...This movie isn't really funny but it has some funny scenes. For example when Buddy goes to the mall and see's Santa Clause for the first time but he notices that its an impostor, then they start fighting...Another funny scene is when Buddy hangs out with his brother Michael after school then they see bullies throwing snow balls at them, so Buddy starts making a ton of snow balls then they start firing back at them and the bullies leave and run away. That was classic The movie is a really nice film but it has its mistakes, anyway great work",2008-10-05,"Oct 5, 2008",7.0,1,1,0,Floated2,False,True,229,https://www.imdb.com/title/tt0319343/review/rw1956257/?ref_=tturv_perm_175
176,rw2913892,childlike Ferrell fun,Orphan Buddy (Will Ferrell) sneaks in Santa (Edward Asner)'s bag and ends up in the North Pole. Papa Elf (Bob Newhart) raises Buddy as an elf. His giantness causes all kinds of problems. Santa allows him to go to New York City to find his birth father Walter Hobbs (James Caan) who is actually on Santa's naughty list. He gets a job at a store and befriends fellow worker Jovie (Zooey Deschanel). Childlike Will Ferrell is giving off so much joy and innocence. He is so silly that it is impossible to not laugh at his slapstick humor. He fully commits and that's what makes it so hilarious. The only minor difficulty lies with James Caan. His personality is way too intense for a wacky comedy. But it picks up whenever he reunites with sweetheart Zooey Deschanel. And he has good fun with his brother Michael. Jon Favreau has created a wacky comedy with a heart.,2013-11-30,"Nov 30, 2013",8.0,3,1,2,SnoopyStyle,False,True,157,https://www.imdb.com/title/tt0319343/review/rw2913892/?ref_=tturv_perm_176
