row_id,imdb_review_id,review_title,review_text,review_date,review_date_raw,movie_review_score,helpful_up,helpful_down,helpful_net,username,spoiler_collapsed_in_source_file,review_text_available,review_word_count,permalink
1,rw0875509,Elf Will Be A New Christmas Classic!,"After seeing ""Elf"" last night (special preview screening) I am happy to say that I, as well as my children left the theater feeling full of Christmas cheer. I do believe that this movie will become a Christmas classic. I can see this movie being viewed by millions each year on TV just like ""A Christmas Story"", and ""It's a Wonderful Life"". Was the movie perfect? No. Will it win an Oscar? Of course not. Did it make me laugh, and feel good while looking forward to another Christmas this year. Without a doubt. 7 out of 10 Stars.",2003-10-31,"Oct 31, 2003",7.0,63,10,53,korch-3,False,True,99,https://www.imdb.com/title/tt0319343/review/rw0875509/?ref_=tturv_perm_1
2,rw2361628,"Sweet and charming, salvaged by the cast","Elf isn't a perfect Christmas movie, but it was sweet and charming with a great cast. The script can be a little too fluffy and unfocused sometimes though, while the pace occasionally lags and some jokes such as Buddy eating the sweets felt forced. However, it does look terrific, with the locations striking and the cinematography very nice. The soundtrack is a nice addition too, it made me nostalgic and all the more ready for Christmas. The story while simple and a tad predictable is at least original and well-meaning, while the direction is credible. The cast is what gives Elf its staying power and charm. Although I am not a fan of Will Ferrell, I think he really shone here as Buddy, while Zooey Deschannel is beautiful and a huge part of the film's charm, James Caan is a suitably gruff father-like figure and Bob Newhart is wonderful. All in all, it is a sweet film if you forgive the slightly cliché ending, by all means not for all but the cast do save the day. 7/10 Bethany Cox",2010-12-31,"Dec 31, 2010",7.0,35,8,27,TheLittleSongbird,False,True,183,https://www.imdb.com/title/tt0319343/review/rw2361628/?ref_=tturv_perm_2
3,rw1785330,A star is born in this laugh-out-loud holiday comedy...,"Charming Christmas confection--about a boy raised by elves in the North Pole who grows up and journeys to N.Y.C. in search of his biological father--puts a clever spin on even the most familiar gags, successfully walking a fine line between absurdist comedy and holiday schmaltz. Will Ferrell looks like a string-bean in yellow tights and, with his mass of curly hair peeking out from underneath his elf's hat, he could easily be used as a walking punchline. Fortunately, director Jon Favreau's handling of ""Elf"" is incredibly nimble, treating Ferrell and his naive character Buddy with the utmost respect; you can laugh at all the silly pranks without ever feeling guilty. Favreau's work is smooth, and he's assembled an incredible supporting cast of character actors to back his star, though some may find the climactic moments (involving Edward Asner as Santa Claus) a bit too literal--and the movie is certainly funnier before we get to this point. Still, the special effects are kept to a minimum in order to let the people shine...and that's not only refreshing, it's heart-warming. *** from ****",2007-12-23,"Dec 23, 2007",7.0,47,15,32,moonspinner55,False,True,187,https://www.imdb.com/title/tt0319343/review/rw1785330/?ref_=tturv_perm_3
4,rw0875572,"A really nice, funny movie for Christmas despite a little bit of the inevitable smaltz","Accidentally finding his way into Santa's bad once Christmas Eve, little baby orphan Buddy ends up in the north pole, where he is raised by the elves as one of their own. As he gets ever bigger and less and less suited to the elf lifestyle he is told about his real father and decides to go to New York to find him. However Buddy's natural smile and elfish enthusiasm doesn't really fit in with New York, not to mention a father who rejects him. When I first saw the trailer for this film I laughed slightly but I also thought that it could easily be just awful. Despite this fear I decided to go and see it on the basis of seeing Ferrell in the Reloaded MTV spoof on the DVD and being very funny. I was glad that I did as the film was refreshingly funny very enjoyable despite the weaknesses inherent in a seasonable film of this nature. The jokes are a mix of adult and children - but not separately, the humour is of a nature families can all enjoy rather than being of a `one for me and one for the kids' type. The film does get a little sweet towards the end, but it manages to avoid this usual trap for the majority of the film and can't be expected to not be all Christmas cheer at some point! The fish out of water stuff is pretty funny and Farrell makes his character funny without being annoying to the audience (as he feared he might be from the trailer). Caan is good but has to work with the `scrooge' character of the film and thus gets fewer laughs. The support cast is good with fun turns from Newhart, Asner and Steenburger. It does get a little sickly sweet towards the end and the fish out of water jokes do wear a little thin towards the end but mostly it is very funny and refreshingly fun to watch. The film is made better by a performance from Farrell that is perfectly pitched without being annoying and full of spark and wit.",2003-11-16,"Nov 16, 2003",,84,29,55,bob the moo,False,True,355,https://www.imdb.com/title/tt0319343/review/rw0875572/?ref_=tturv_perm_4
5,rw0875675,This will play on television every year for the rest of our lives,"This is a good natured holiday comedy that definitely is in the same realm as ""The Santa Clause"" and (Dare I say?) ""Miracle on 34th Street"". Story is about a human that has been raised by Santa's elves at the North Pole and as he gets older he figures out that he's very different from the other elves. Years earlier Santa (Ed Asner) was delivering at an orphanage and a human baby accidentally crawled into his sack and was taken back to the North Pole where he was raised by Papa Elf (Bob Newhart). He is called Buddy (Will Ferrell) and he grows to six foot three and one day he is told the truth about his situation and told by Santa who his real father is. Buddy travels to New York City to meet his father and he heads to the Empire State Building where he works. He finds his father Walter (James Caan) who runs a publishing business and works all the time much to the chagrin of his family. Walter is unable to get away from Buddy and after a blood test proves he is his son he takes him home with him to stay with his family. He meets Walter's wife Emily (Mary Steenburgen) and their son and Walter thinks Buddy is just someone reverting to his childhood after a shock. Buddy starts to work in a department store and he meets a woman named Jovie (Zooey Deschanel) and is smitten by her. Buddy tries to fit in with the others but finds it difficult although he becomes friends with Walter's son and starts dating Jovie. This film is directed by Jon Favreau who has made his mark as a director of low budget films like ""Made"" and also as a character actor but this is his first effort at directing a mainstream Hollywood movie. He does a commendable job and as I watched this film I kept having the feeling that he purposely made the most commercial film that he could. Favreau as an actor has mostly appeared in small roles. As a director his small films are lucky to play at art house theaters and I seriously doubt he's getting rich hosting ""Dinner For 5"" on the Independent Film Channel. It looks as though he wanted to make a crowd pleasing film that will ultimately be playing on some cable channel for the rest of our lives. I'm not knocking this decision at all, it's a smart move and he's become a major Hollywood player with the success of this film. Even the script was carefully written to insure that WHEN this plays on television there will be nothing to edit out. The closest thing to a bad word is uttered by Caan when he says ""Hell"" once towards the end of the film. This is a fun film that does have undeniable charm and its heart is definitely in the right place. It's sentimental and corny but thats part of the appeal. The script doesn't try to hard and the energy and flow of the film keeps at a constant pace, it doesn't try to go over the top which is refreshing. Ferrell is a natural performer and his dopey wide eyed expressions never grow old. This film must be doing something right because tough guy James Caan is believable as a caring husband and father. Very old fashioned story that never raises itself above lightweight status is nonetheless funny and charming. Like I said earlier, this film will be playing on television every year for the rest of our lives!",2003-12-22,"Dec 22, 2003",6.0,95,54,41,rosscinema,False,True,598,https://www.imdb.com/title/tt0319343/review/rw0875675/?ref_=tturv_perm_5
6,rw9487971,Finally watched Elf...,"After 20 years of thinking it would probably be a silly waste of time and listening to the naysayers (like my husband) that it was stupid. So, if you are like me and haven't watched this, then put on your childlike wonder, forget that you are a grown-up and enjoy this very enjoyable and funny movie. Chill out and laugh out loud. Bob Newhart is hilarious as papa Elf and Ed Asner plays a marvelous Santa. Now I understand why Zooey Deschanel now has black hair, because in this movie she has blond hair and it does not suit her well. Give this movie a chance, don't wait 20 years to watch it like I did!",2023-12-11,"Dec 11, 2023",10.0,38,6,32,RuthMariaK,False,True,117,https://www.imdb.com/title/tt0319343/review/rw9487971/?ref_=tturv_perm_6
7,rw9500358,A Must Watch During the Christmas Season,"Elf is a fun Christmas film that has a guy living as an elf then going to the ordinary human society. I feel like that led to good humor throughout and I find kinda interesting. For me, it's within my top 5 Christmas movies. I feel like Will Ferrell did a good job as Buddy. He really nailed the hyper personality. It's a role that I really tie to Ferrell, I can't see anyone else playing the role. Also this is the first role that comes to my mind when someone says Will Ferrell. This movie helps bring a more well defined definition of Christmas spirit. It's about being together and believing it. Seeing something may not be the same as believing something. You could take the quote from the Santa Clause and apply it here. ""Seeing isn't believing, believing is seeing!"" I feel like this is full of Christmas spirit and a must watch during the Christmas season.",2023-12-17,"Dec 17, 2023",7.0,8,2,6,auskooper,False,True,159,https://www.imdb.com/title/tt0319343/review/rw9500358/?ref_=tturv_perm_7
8,rw3391135,Unexpected out of nowhere against all odds classic,"This was my 4th viewing and now ready to review. The story is insane. This film should not have worked. But almost as a tribute to the X-Mas miracles it tries to riff off, it is an astonishingly entertaining film. Behind the camera Favreau, Mr Money Shot, who has quietly without fanfare turned into one of the hottest directors in Hollywood history. In front of the camera Farell who I usually don't care for but may just give the performance of his career here. A script to die for. Probably the best use of Zoey D's looks in her career to date. Way under rated and unappreciated. As in my other reviews, most ""recent"" X-Mas films (since about 2000) are Canadian B-movies shot on a budget which would barely cover a reno on THIS OLD HOUSE What an unexpected treat See it",2016-01-08,"Jan 8, 2016",9.0,115,28,87,A_Different_Drummer,False,True,145,https://www.imdb.com/title/tt0319343/review/rw3391135/?ref_=tturv_perm_8
9,rw4508804,"After so many years, I finally got to watch Elf and consider it quite a funny and partly touching movie","Confession time: Until just a couple of hours ago, I had never seen this now-classic Christmas comedy starring Will Ferrell in the title role. He's an actual human who as a baby was taken to the North Pole accidentally and was raised by elder elf Bob Newhart. After becoming the least prolific of workers at Santa's Workshop, he decides to go to New York to find his biological father who's played by James Caan. I'll stop there and just say this was quite funny and had also some touching scenes. Because this was a family film, there's no dirty language nor any adult situations. In summary, Elf is a wonderful comedy suitable for kids ""from 1 to 92""!",2018-12-13,"Dec 13, 2018",7.0,15,7,8,tavm,False,True,119,https://www.imdb.com/title/tt0319343/review/rw4508804/?ref_=tturv_perm_9
10,rw0875697,"This is a wonderful, original and perfectly portrayed film.","This was one of my favorite movies in 2003. Will Ferrell is brilliant as the Elf. The supporting cast is great too, especially Bob Newhart as his elf ""dad"". The characters are well written and it is a refreshing film to get lost in. Will Ferrell plays the elf with such innocence, he is so funny! This is not just a Christmas film but when the DVD comes out I will be watching ""Elf"" in July. The story progresses nicely, there are many lessons to be learned as you watch this movie. It touched my heart in many ways. I highly recommend this movie for kids AND adults, you won't regret it. Treat yourself and watch this ""original"" movie. Hollywood needs to make more like this.",2004-06-24,"Jun 24, 2004",10.0,153,49,104,della-10,False,True,126,https://www.imdb.com/title/tt0319343/review/rw0875697/?ref_=tturv_perm_10
11,rw9248218,A Heartwarming Holiday Comedy That Spreads Joy and Laughter,"""Elf"" is a delightful holiday comedy that brings the Christmas spirit to life with warmth, humor, and a touch of whimsy. Directed by Jon Favreau, this film has become a beloved classic since its release, enchanting audiences of all ages with its endearing story and memorable characters. The movie follows Buddy, a human who mistakenly ends up in the North Pole as a baby and is raised as an elf. As Buddy grows older, he learns the truth about his origins and embarks on a journey to New York City to reconnect with his biological father. In the bustling metropolis, Buddy's innocent and childlike nature clashes with the cynicism of the modern world, leading to hilarious and heartwarming moments. Will Ferrell's performance as Buddy is nothing short of brilliant. He fully immerses himself in the role, capturing the essence of Buddy's childlike wonder and boundless enthusiasm with impeccable comedic timing. His infectious energy and genuine charm make him instantly lovable, and his interactions with the other characters are a joy to watch. The supporting cast, including James Caan, Zooey Deschanel, and Bob Newhart, delivers excellent performances, complementing Ferrell's comedic genius. Their chemistry and the genuine warmth they bring to their roles add depth and heart to the story. ""Elf"" is a visual treat, with vibrant and colorful sets that evoke the magic of the holiday season. The film's humor is a delightful mix of slapstick comedy, clever wordplay, and heartwarming moments that will leave you with a smile on your face. Beyond the laughs, ""Elf"" also carries a valuable message about the importance of family, kindness, and embracing the joy and wonder of the Christmas season. It reminds us to cherish the simple pleasures in life and to approach each day with childlike enthusiasm. In conclusion, ""Elf"" is a heartwarming and hilarious holiday comedy that has earned its place as a beloved classic. With its unforgettable characters, clever humor, and genuine warmth, this film is a must-watch for anyone seeking a dose of Christmas cheer. It captures the spirit of the season and reminds us of the power of love, laughter, and the magic that resides in all of us.",2023-08-09,"Aug 9, 2023",7.0,7,2,5,Videouploader2013,False,True,361,https://www.imdb.com/title/tt0319343/review/rw9248218/?ref_=tturv_perm_11
12,rw1473744,An Uplifiting and Cheerful Display of Raw Uninformed Innocence,"Will Ferrell does a great job here, and it's the perfect Christmas (Holiday) movie that can be enjoyed anytime of the year. The contrast of almost unbalanced folly of Will's character with those that encompass him, lends a great degree of innocence and non-stop joy and plenty of laughter as he leaves the mundane world of the usual, boring, and often time intolerance of the world in his dust. It's refreshing to see a story where others are encouraged to rise to the level of this main character instead of him being overwhelmed and dragged down by the majority of ""Cotten Headed Ninny Muggins"", a.k.a. the ""touch me not, speak to me not"" big city public psyche so familiar that many walk around with. For those that represent the general public in the movie, as well as the audience, Ferrell's character dares us to believe again, even for a moment of the magic of Christmas and tears down decades of political correctness to connect us with the late 60s and 70s when so many annual Holiday shows brought us a seemingly sustained desire to entertain ourselves with the magic that waxes then wanes but for a few short weeks each year. Whether a work of animation or raw theater, this refreshing story brings vitality and rekindles childhood memories for the kid in all of us.",2006-09-13,"Sep 13, 2006",10.0,67,23,44,Montezuma59,False,True,228,https://www.imdb.com/title/tt0319343/review/rw1473744/?ref_=tturv_perm_12
13,rw6352056,I'm still surprised this became a classic,"I remember when I saw ""Elf"" in the theater. I thought it was pretty funny. I never would have guessed that 17 years later it would become a Christmas classic. There are a lot of laughs in this movie. There's also a lot of good music. The cast is very likeable, especially a dreamy Zooey Deschanel. They all do a nice job. ""Elf"" has so much goodwill going for it that it almost gets over its bumps in the road. For some reason, it's never a completely satisfying watch with me.",2020-12-10,"Dec 10, 2020",6.0,11,5,6,pmtelefon,False,True,91,https://www.imdb.com/title/tt0319343/review/rw6352056/?ref_=tturv_perm_13
14,rw6399103,Not that good,"As a general rule, I don't like Will Ferrel movies, I find his over the top acting annoying and simply not funny. Elf was no exception. I watched Elf because it was hailed as the best Christmas movie of all times, I don't agree with that at all. It did have some cute elements that would have made an enjoyable film, but the annoying antics of Ferrel didn't work for me. But clearly I am in the minority - so there is that.",2020-12-25,"Dec 25, 2020",3.0,25,20,5,mjdk2,False,True,82,https://www.imdb.com/title/tt0319343/review/rw6399103/?ref_=tturv_perm_14
15,rw0875552,A Wonderful Christmas Movie! Absolutely Worth Seeing!,"Elf (2003) I sure wish they would have released this movie in December, it would have given it an even Christmas-ier spirit to it all. Elf was a hilarious movie about a guy named Buddy (Will Ferrel), who was raised by elves at the North Pole. He then discovers he isn't an elf, and travels to New York city to find his real father (James Caan). It turns out his that Buddy has a stepbrother and a stepmother (Mary Steenburghen). While there, he meets Jovie (Zooey Deschanel) at a store there, and falls in love. This movie is all about Christmas spirit and is wonderful and enjoyable. It's a great family movie. You should take you ands your family to it during the holiday season. This will be one of those Christmas movies that I will be able to watch over and over. I give Elf a 10/10.",2003-11-12,"Nov 12, 2003",,35,18,17,movies2u,False,True,150,https://www.imdb.com/title/tt0319343/review/rw0875552/?ref_=tturv_perm_15
16,rw9514212,"I like this movie, but not as much as others","I like Elf. I enjoy watching Elf. I find this movie amusing. However, I don't like it as much as many other people do, and that seems to turn them into angry elves. Will Ferrell's enthusiasm as he plays Buddy the Elf is contagious, and you can't help but smile at his innocent ignorance. James Caan also plays the part of the reluctant father so well that you wonder if he's actually going to kill Buddy. Where this modern Christmas classic starts to wear out its welcome is the ending, which unfortunately gets a little too cheesy for me. I'm happy to watch Elf every now and then, but not every year.",2023-12-24,"Dec 24, 2023",7.0,5,1,4,cricketbat,False,True,112,https://www.imdb.com/title/tt0319343/review/rw9514212/?ref_=tturv_perm_16
17,rw5159227,Classic Christmas spirit.,"This is the kind of Christmas movie you should be watching every 25th of December apart from your usuals. It's a wonderful story, with a strong Will Ferrell, playing an innocent, child-like, distracted elf who has no idea how the real world functions, as he is on the quest to search for his real family. He is willing to spread the Christmas spirit on a city which apparently hasn't got the spark in its eyes, so there is a hard task on his hands. The rest of the cast is wonderfully completed by Zooey Deschanel, James Caan, Mary Steenburgen, Daniel Tay, with Peter Dinklage and Bob Newhart in small roles. Ferrell definitely steals the movie; and his troubled relationship with his father (Caan) provides some funny and touching moments as well. Jon Favreau did quite a good job from the director's chair, turning this seemingly childish film into a marvelous choice for your Christmas movies of every year. Some even regard it as a classic, but well, I will let you be the judge of that.",2019-10-03,"Oct 3, 2019",8.0,42,13,29,patriciogl10,False,True,177,https://www.imdb.com/title/tt0319343/review/rw5159227/?ref_=tturv_perm_17
18,rw9376103,A Christmas classic for the right reasons,"It's hard to believe that I haven't seen ""Elf"" in the last twenty years but I figured that I'd fix that before the sequel is released. Which of course will never happen because the three stars (Will Ferrell, James Caan and director Jon Favreau) didn't hit it off. Which is a shame because this is a funny, well constructed story with its heart in the right place. Ferrell plays the role of Buddy the Elf and this is someone who embodies elf-life to a tee. He eats nothing but candy, thinks nothing of singing badly in front of strangers and just wants to spread happiness throughout the world. I know that it sounds cheesy but Ferrell pulls it off by being 100% committed to Buddy. He really is an innocent abroad in New York City. Caan plays his unsuspecting father (someone who's definitely on the naughty list) and his lack of reaction to Buddy's antics also plays well. The contrast between the two could not be starker. However the film is Favreau's baby and he really nailed it with this one. It's a feel-good film but it's not over the top. There are special effects but many of them were achieved in-camera and so don't look dated. Ferrell is allowed to be appropriately wacky but the film never makes fun of him. Instead it's a simple tale about a simple man/elf with a simple wish. You'd have to have a heart of stone not to grant his one true desire at such a festive time.",2023-10-14,"Oct 14, 2023",7.0,9,4,5,movie-reviews-uk,False,True,259,https://www.imdb.com/title/tt0319343/review/rw9376103/?ref_=tturv_perm_18
19,rw0971795,"Great, Clean Christmas movie!","It was so nice to be able to sit down and watch a movie featuring an SNL actor without having to mute or fast forward any crude parts. Granted, this may not be Will Farrell's most amazing performance, but if you want a new Christmas movie to watch this season, I highly recommend Elf. I talked to a few people who thought the movie was stupid, but that was because they were expecting Will Farrell's character to be a duplicate of his SNL performances. So, to fully enjoy this movie, watch it without any expectations and remember that it's okay to have a childlike sense of humor--nobody's too cool for a great Christmas movie. I love most all the movies from Adam Sandler, Rob Schneider, Will Farrell, Jim Carrey, Chris Farley, Chevy Chase, and David Spade, but most of them aren't appropriate for viewers of all ages. Elf is a movie you can throw in the VCR and not have to worry about what the kids hear or see on it. Thanks, Will, for putting out a hilarious movie that the whole family can watch!",2004-12-03,"Dec 3, 2004",10.0,95,43,52,dph570,False,True,186,https://www.imdb.com/title/tt0319343/review/rw0971795/?ref_=tturv_perm_19
20,rw4998414,"""Will Ferrell Is A Manbaby: The Movie""","I don't think this movie is bad, in fact whenever I have nothing better to do BUT watch this film I enjoy my time with it. But I don't get the praise or why it has garnered ""Christmas Classic,"" status. I'm sure I am missing something, but my complaints have already been vaguely explained up above.",2019-07-16,"Jul 16, 2019",6.0,11,5,6,svivschenk,False,True,56,https://www.imdb.com/title/tt0319343/review/rw4998414/?ref_=tturv_perm_20
