row_id,imdb_review_id,review_title,review_text,review_date,review_date_raw,movie_review_score,helpful_up,helpful_down,helpful_net,username,spoiler_collapsed_in_source_file,review_text_available,review_word_count,permalink
238,rw2566064,Elf is fun,"This film is directed by Jon Favreau who has made his mark as a director of low budget films like ""Made"" and also as a character actor but this is his first effort at directing a mainstream Hollywood movie. He does a commendable job and as I watched this film I kept having the feeling that he purposely made the most commercial film that he could. Favreau as an actor has mostly appeared in small roles. As a director his small films are lucky to play at art house theaters and I seriously doubt he's getting rich hosting ""Dinner For 5"" on the Independent Film Channel. It looks as though he wanted to make a crowd pleasing film that will ultimately be playing on some cable channel for the rest of our lives. I'm not knocking this decision at all, it's a smart move and he's become a major Hollywood player with the success of this film. Even the script was carefully written to insure that WHEN this plays on television there will be nothing to edit out. The closest thing to a bad word is uttered by Caan when he says ""Hell"" once towards the end of the film. This is a fun film that does have undeniable charm and its heart is definitely in the right place. It's sentimental and corny but thats part of the appeal. The script doesn't try to hard and the energy and flow of the film keeps at a constant pace, it doesn't try to go over the top which is refreshing. Ferrell is a natural performer and his dopey wide eyed expressions never grow old. This film must be doing something right because tough guy James Caan is believable as a caring husband and father. Very old fashioned story that never raises itself above lightweight status is nonetheless funny and charming. Like I said earlier, this film will be playing on television every year for the rest of our lives!",2012-02-14,"Feb 14, 2012",6.0,0,0,0,lee-dugan,False,True,328,https://www.imdb.com/title/tt0319343/review/rw2566064/?ref_=tturv_perm_238
239,rw6370031,Instant Christmas Classic,"'Elf' is my third favourite Christmas movie. Consistent innocent laughs throughout. Will Ferrell delivers a wonderful performance as a misfit elf in a brand new big world. It's impossible not to fall in love with Buddy the Elf. Sometimes we need a reminder to be a lot nicer to one another. As naive as Buddy is, all he tries to do is be nice to everyone he meets, and spread Christmas cheer. This film is a great yearly reminder of that.",2020-12-16,"Dec 16, 2020",9.0,3,2,1,Slarkshark,False,True,81,https://www.imdb.com/title/tt0319343/review/rw6370031/?ref_=tturv_perm_239
240,rw5285045,Enjoyable,"I had seen parts of Elf and then one day I watched the whole movie. And I was surprised at how much I enjoyed it. Will Ferrell is wonderful as Buddy. I also enjoyed watching Bob Newhart as papa elf. Its not the sides of my mouth hurt from laughing funny but, there are some laughs in the film. I am glad I took the time to watch it. I would have missed a good movie if I had been satisfied with only watching parts of it.",2019-11-27,"Nov 27, 2019",7.0,0,0,0,moivieFan,False,True,87,https://www.imdb.com/title/tt0319343/review/rw5285045/?ref_=tturv_perm_240
241,rw3372379,Hilarious Christmas fun,"Jon Favreau's Elf is as snappy as holiday comedies come, mainly thanks to Will Ferrell's pretty damn hilarious performance as Buddy, a human baby stranded in the north pole and raised by pint sized elves as one of their own. Ferrell can be overbearing at times with his often hard to swallow brand of abrasive humour, but there's always moments where he reigns it in, sticks to the script and gives us magic. I think that this being a family film dictates that he especially needs to play it close to the chest and gives him a comedic track to run on without derailing into the desperate realm of cringy improv and sticking to the screenplay's wonderful jist, and not smothering it in ego and comedic decadence. It's a wonderfully sweet script as well, seeing Buddy travel from the north pole to bustling Manhatten to locate his long lost human family. His cranky birth father (craggy, immortalized James Caan) wallows in lukewarm disbelief as Buddy follows him everywhere, including back home to spend time with bis wife (Mary Steenburgen) and kids. He sorta kinda finds work in a mall due to his inherent elf-ness and gets himself into all kinds of trouble, until he catches the eye of a hired elf played by adorable Zooey Deschanel, who's got herself a case of the Christmas blues. Ferrell's upbeat, manic tone combined with Zooey's dry, laconic yet amused personality makes for perfect chemistry, especially in their odd, compelling rendition of 'Baby its cold outside'. Buddy blunders his way from one austere NYC situation to the next with shiny naivety and blind, trusting optimism to hysterical payoff, a dynamic which sits at the core of what's made the film so successful over the years. The only bad note for me is a terrifying animated version of the north pole that looks like Wallace and Gromit got drunk on rum and eggnog and dreamt some creepy version of Santa's homestead, complete with eerie talking seals. Director Favreau participates in a cameo as Caan's family doctor, Edward Asner shows up as a jolly enough Santa, and Bob Newhart steals many laughs as Buddy's awkward surrogate elf father.",2015-12-15,"Dec 15, 2015",8.0,3,2,1,NateWatchesCoolMovies,False,True,363,https://www.imdb.com/title/tt0319343/review/rw3372379/?ref_=tturv_perm_241
242,rw0875571,The Magic Of Christmas,"ELF is one of the best Christmas movies out there. It is funny, charming, and well acted. The always-funny Will Farrell plays Buddy, a human who grows up as an ELF. After finding out that he is not original from the North Pole, Buddy sets out on a journey to find the family that he left behind. This takes him to New York City, where he meets his dad who is anything but thrilled to see him. Now Buddy must learn that sometimes life isn't so jolly, and help the people he has just met find the Christmas spirit that is inside all of us. Co-starring in the film is James Caan, Mary Steenburgen, and Bob Newhart. Elf is a family movie that everyone both young and old will find on the top of their must see lists. 3.9 out of 5 B+",2003-11-15,"Nov 15, 2003",7.0,0,0,0,ForReal84,False,True,146,https://www.imdb.com/title/tt0319343/review/rw0875571/?ref_=tturv_perm_242
243,rw7628137,Not good,"I wanted to like this, but it is just too stupid and corny. It's a shame because it has Will Ferrell, James Caan, Mary Steenbergen, and others that are usually quality performers. However the story is just too corny and rediculous.",2021-12-09,"Dec 9, 2021",5.0,3,2,1,lcase-13401,False,True,41,https://www.imdb.com/title/tt0319343/review/rw7628137/?ref_=tturv_perm_243
244,rw0875696,F-U-N-N-Y,"After seeing this movie at a sneak preview, I gotta say I loved it!! I hadn't heard much about it and really wasn't interested as most movies starring members of SNL are usually not very good! But was I ever pleasantly surprised! This movie was really funny! Wil (Buddy the elf)was hliarious as a man raised to believe he is an elf. His genuinely good heart and sweet disposition just make you smile, even when hes not saying a word. To see 'tough guy' James Caan in a comedy was also a bonus- he is great as a cold-hearted New York career man! As always, Bob Newhart is just awesome- who is more funny than him? His facial expressions alone deserve comedy awards!!! True this film is not gonna win any awards but who cares?! It has a great supporting cast, all of whom play their parts perfectly! Its is funny, enjoyable and a really good holiday picture. Great for kids, adults, teenagers, whoever!! You're gonna laugh and thats what a comedy is for!!!",2004-04-13,"Apr 13, 2004",,1,1,0,sirdouglas20,False,True,176,https://www.imdb.com/title/tt0319343/review/rw0875696/?ref_=tturv_perm_244
246,rw5941378,How can you not like it???,"It blows my mind that this movie doesn't have higher ratings. It's an amazing, family-friendly, funny Christmas movie filled with great music, mischief, and more! What's not to like? Honestly, I feel bad for people who don't like this movie. They have to be pretty miserable and pessimistic to not find any joy in such a wonderful, quotable, all-around-happy film.",2020-07-26,"Jul 26, 2020",10.0,3,2,1,chloejenkins-56567,False,True,63,https://www.imdb.com/title/tt0319343/review/rw5941378/?ref_=tturv_perm_246
247,rw3596223,"Great, Funny Movie You'll Watch Time and Time Again","This is a hilarious movie where Will Ferrel will crack you up! In this movie, he acts like a naive,little kid, and it's hilarious! It's a terrific movie to get introduced to Will Ferrel. There's moments in the movie that you'll be able to relate to so well, regardless of your age, not to mention moments that are just plain funny! The writing is good, the acting is good, and characters are decently relatable. The characters are well-defined, and you get the feeling that the actors had a fun time during the making of this movie! Overall, you'll greatly enjoy this movie time and time again with it becoming a great part of your childhood if you're a kid, or if you're an adult, a great time spent with friends and family or just a fun time laughing at the great humor in this film!",2016-12-10,"Dec 10, 2016",7.0,0,0,0,caidenw-37050,False,True,147,https://www.imdb.com/title/tt0319343/review/rw3596223/?ref_=tturv_perm_247
249,rw0875581,I laughed,"This was a pretty good movie. It wasn't GREAT, but it was good. I gave it a 6. Will Ferrell was really funny. The first thirty minutes were hilarious. It got a little corn-ball twords the end. Jon Favreau did a good job directing. This is an interesting movie for him and after MADE, I expected it would be darker. Bob Newhart was great. He didn't have a large roll, but he cracks me up.",2003-11-13,"Nov 13, 2003",6.0,0,1,-1,jmbunnell,False,True,76,https://www.imdb.com/title/tt0319343/review/rw0875581/?ref_=tturv_perm_249
250,rw5341945,Funny Christmas Movie.,"Review: 'Elf' is a Christmas comedy film directed by Jon Favreau. Possible one of the funniest Christmas movies to come out of the 21st Century. This is a movie I watch all year round, not just around Christmas time. The film centers on Buddy (Will Ferrell), a human who was adopted and raised by Santa's elves. He learns about this and heads to New York City to meet his biological father (James Caan) while also spreading Christmas cheer in a world of cynics in the process. Will Farrell makes his character funny without being annoying to the audience (as he feared he might be from the trailer). James Caan is good but has to work with the scrooge character of the film and thus gets fewer laughs. It's refreshing to see a story where others are encouraged to rise to the level of the main character instead of him being overwhelmed and dragged down by the majority of society. There is nothing I dislike about this film. It's a perfect family comedy that has the Christmas spirit at it's core. Overall, the film is very funny in the beginning, and gets more Christmassy as it goes on. The performances are top notch and could have been carried away with the cheesy comedy. 5/5",2019-12-22,"Dec 22, 2019",10.0,3,2,1,RhapsodyReviews,False,True,214,https://www.imdb.com/title/tt0319343/review/rw5341945/?ref_=tturv_perm_250
251,rw2002484,An unexpected pleasure!,"I signed on to this site now to check if Will Ferrell received any awards for his portrayal of Elf. He really tapped into his inner child for this one, because he is spot-on in this role. Its a difficult job for any adult actor to convey such innocent charm. The supporting characters are good, the directing very good, and the writing is excellent. I loved the run home to hide in his bathroom in his undersized house when he had his feelings hurt. The film was weaker in its second half, but Will Ferrell makes Elf such an endearing character that I've watched it repeatedly for just that.I really don't care for Will Ferrell's other movies or characters, but this was a wonderful performance!",2009-01-06,"Jan 6, 2009",7.0,0,2,-2,lostto,False,True,127,https://www.imdb.com/title/tt0319343/review/rw2002484/?ref_=tturv_perm_251
252,rw8697428,The best way to spread Christmas cheer is watching this movie every year,"I can't even count the number of times I've seen this movie but I will stop to watch it every time I come across it in the channel guide. It's a fun, feel good family movie with something for people of all ages. My teenage kids have watched it since they were little and they loved watching Buddy and the antics he was involved in. Seeing him bring the spirit of Christmas to those who had none got them ready to see Santa. Now that they're older, they still get a thrill from watching the movie and now they get some of the jokes they didn't get when they were younger. Will Ferrell is perfectly cast as Buddy- an man-sized 'elf' with childlike wonder in New York City for the first time. James Caan playing his unbelieving father and Zooey Deschanel as the cute love interest are both great in their roles as they indulge Buddy and his beliefs while not quite sure if he's mentally ill or just crazy about the holidays. There are other great actors in this movie too but I have to say that seeing Bob Newhart playing Papa Elf is something you have to experience at least once in your life, or preferably at least once every Christmas.",2022-11-27,"Nov 27, 2022",10.0,3,2,1,jennvelope,False,True,214,https://www.imdb.com/title/tt0319343/review/rw8697428/?ref_=tturv_perm_252
253,rw1550961,Very mixed review.,"Stars: Will Ferrell, James Caan, Ed Asner, Zooey Dechanel, Bob Newhart, Amy Sedaris, Andy Richter, Kyle Gaas, Artie Lange. Let me start by saying that I thought all the performances in this film were good. Will Ferrell was good, James Caan kept the movie afloat, Bob Newhart was a great presence. With such a great cast, I'm amazed they made such a mediocre film. The character of buddy the elf is kind of a one note joke, ""fish out of water"" character that really has no development in the film. Buddy is a human, who was raised as an elf, that goes back to New York to visit his birth father who never knew he was born. In New York he acts like an idiot, getting hit by cars and eating gum off the bottom of benches, etc. Buddy meets a girl played by Zooey Dechanel, who has a problem singing in public. I guess this movie is good for kids, but I found it to be very stupid. I thought Bob Newhart's narration (through the beginning and at the end) was a nice touch. My rating: C. 94 mins. PG for crude humor and mild language",2006-12-21,"Dec 21, 2006",6.0,0,1,-1,TOMNEL,False,True,197,https://www.imdb.com/title/tt0319343/review/rw1550961/?ref_=tturv_perm_253
254,rw0875669,Humbug,"The small children surrounding me didn't laugh at -Elf-. Their small mouths grimly wired shut, they didn't laugh at the ""zany"" hi-jinks, they didn't laugh at the ""jokes,"" and they certainly didn't smile when Will Ferrill played ""cute."" I can't blame them. -Elf- is a derivative, predictable march through a series of contrived mishaps and ham-fisted doses of insipid tenderness. James Caan is horribly miscast and fails to display any of the warmth that his part calls for. He's not even a good straight man. He's just joyless and angry, rushing through his lines. At least, Bob Newhart does a decent job as a fatherly elf. And the special effects were pretty good. I've never seen a better flying sled. Still though when the lights came on, the children and I felt more holiday despair than joy.",2003-12-14,"Dec 14, 2003",1.0,17,32,-15,prince_hamlet,False,True,139,https://www.imdb.com/title/tt0319343/review/rw0875669/?ref_=tturv_perm_254
257,rw6270344,Classic Christmas movie!!,One of my favorite Christmas movies. Will Ferrell was a great choice for the elf. Great cast. Extremely funny and goofy with a great story. Just sit back and enjoy.,2020-11-14,"Nov 14, 2020",10.0,4,4,0,dfrank-12,False,True,30,https://www.imdb.com/title/tt0319343/review/rw6270344/?ref_=tturv_perm_257
258,rw3601946,6.5/10,"Thirty years prior to the events of the film, a baby crawls into Santa's sack at an orphanage. Santa unwittingly takes the baby back to the North Pole, where it is decided that Papa Elf (Bob Newhart) will raise him. The baby, named Buddy (Will Ferrell), is raised unaware that he is actually a human, until his enormous size and poor toy-making abilities cause Papa Elf to tell him the truth. The old elf reveals that Buddy was born to Walter Hobbs and Susan Wells and placed up for adoption, that Walter never knew Buddy was born, and that he now works at a children's book company in New York. Immediately and full of optimism, Buddy sets out for New York to find his father. ""Elf"" is self consciously structured in the most academical and basic way screenplays are written, it is screen writing 1-0-1 and it knows that, so even though it cannot be commended for a remarkable depth, there is just no resisting the charm and the comedy this film has to offer with what is possibly, still to this day, Ferrel's best performance. For someone who has always been somewhat of a Ferrell critic: I have rarely been able to enjoy his comedies and sketches, this film really surprised me and that is exactly because Ferrel is cast perfectly in the role of an over-enthusiastic human who thinks he is an elf. His zany and over the top comedy and his exaggerated facial gestures fit this film perfectly and grace us with moments of really good comedy. Favareau knows how to build upon this and has always the right camera set-up to enhance the comedic effect. He uses the classic shtick of people or objects entering or exiting into frame to incredible effect and even does some innovative things with the technique that really surprised me and had me rolling with laughter. The film also has a classic Christmas message and story: the characters by the end need to save Christmas and to do so they have to believe in the Christmas spirit. It is standard stuff, but the film is written very effectively and its colorful characters navigate through a sufficiently original premise and set-pieces which make for an undeniably pleasant flow. You care about everyone involved thanks to some solid work from all the performers. Yet, once again, what really pushes the film a notch above has to be the comedy, it is inventive and always different, it does not go for the same gag over and over again as it would be easy to do with a fish-out-of-water story. As I said, ""Elf"" cannot be praised for bringing to the table something new. The structure is predictable down to every emotional beat. There isn't a sense of overwhelming emotion involved with the characters and their struggle is never really given depth exactly because we know how it is going to go. Still, the fact that the film is self conscious about that helps it build around a pleasant family movie which is also a very good Christmas comedy with enough flare to keep you pleasantly entertained for the whole duration.",2016-12-19,"Dec 19, 2016",6.0,0,0,0,Giacomo_De_Bello,False,True,535,https://www.imdb.com/title/tt0319343/review/rw3601946/?ref_=tturv_perm_258
260,rw10255761,Good film,"Ferrell has mastered a delivery that plays to multiple audiences at once, allow him to sound wholeheartedly sincere yet uproariously stupid in the same breath, yet uniquely lovable either way. In between the inevitable more kid-friendly slapstick (and thankfully only one burp joke), Ferrell is never crass about Buddy's childlike approach to life, mining it for the utmost of wide-eyed truth, and he's all the funnier and more adorably charming for it. The rest of the cast, thankfully, are game to echo Ferrell's spirit. James Caan is pitch-perfect as the curmudgeonly Scrooge too wrapped up in exploiting nuns and orphanages to pay attention to his giddy elf-son, while (a jarringly blonde) Zooey Deschanel showcases the luminescent, quirky charm that would shortly catapult her into stardom (she even sneaks in a couple of songs for good measure). Ed Astner's gruff warmth makes him the most definitive Santa Claus since Richard Attenborough, and the hangdog charm of Bob Newhart lends the film's narration a perfectly relaxed airiness.",2025-01-12,"Jan 12, 2025",7.0,0,1,-1,follower-321weret,False,True,169,https://www.imdb.com/title/tt0319343/review/rw10255761/?ref_=tturv_perm_260
261,rw7625069,Great Movie for the holidays,A heartwarming Christmas classic that the whole family can enjoy every year. Will Ferell is excellent and brings the Christmas cheer into your living room.,2021-12-08,"Dec 8, 2021",9.0,2,1,1,Josey_Strife,False,True,25,https://www.imdb.com/title/tt0319343/review/rw7625069/?ref_=tturv_perm_261
262,rw8687387,Unexpectedly Fun,"Elf has to be the Christmas classic that everyone falls head over heels in love with as Will Ferrell's performance as Buddy the elf is superb and innocent. From this film's beautiful and mellow score to its humor to its scenery, this is sure to easily become a top favorite when it comes to Christmas films as if this isn't on your list, it definitely will be soon. Though there are random scenes in this film that do not do much for the viewer and the story, there is still a sense that in the end there will be such satisfaction that you'll feel all warm and cozy inside. If anything, you'll want to visit New York during the Christmas season.",2022-11-21,"Nov 21, 2022",6.0,0,0,0,nataliaiglesias,False,True,121,https://www.imdb.com/title/tt0319343/review/rw8687387/?ref_=tturv_perm_262
263,rw11016902,My favourite Christmas film,"Elf is my favourite Christmas movie ever and it still makes me laugh every single time. It is one of those films that never loses its charm no matter how often you watch it. The whole thing is wholesome from start to finish and the cast is perfect. Will Ferrell is hilarious as Buddy and the supporting cast all bounce off him so well. The humour holds up incredibly well and the movie has so many memorable moments that have basically become Christmas traditions at this point. The music is great, the vibe is pure comfort and it captures the feeling of Christmas better than almost anything else out there. It is funny, warm, nostalgic and full of heart. Just the perfect Christmas movie.",2025-12-10,"Dec 10, 2025",10.0,2,1,1,TrulyOnFilm,False,True,124,https://www.imdb.com/title/tt0319343/review/rw11016902/?ref_=tturv_perm_263
264,rw1613710,Will Ferrell makes this movie work,"OK, for the most part the movie was somewhat corny. Here it is, Will Ferrell is playing a guy named Buddy that believes he's an elf. Even though it is rather obvious that he is a LOT bigger than every other elf, he goes on believing it until the elf he referred to as ""dad"" broke it to him that he wasn't an elf. So began Buddy's journey out of the North Pole and to New York to find his real dad. Like I said, a lot of the movie was just corny, but I'll be darned if that guy Will Ferrell isn't a riot. Will Ferrell makes the ridiculous work, he was the perfect cast for the role. I just know that the movie doesn't have the same lustre or appeal with someone else in the role of Buddy. There was hardly a scene that Buddy was in that wasn't funny. And I would watch the entire movie again just to hear him say, ""He's an angry elf,"" when referring to an irate midget. Priceless.",2007-03-08,"Mar 8, 2007",7.0,0,0,0,view_and_review,False,True,176,https://www.imdb.com/title/tt0319343/review/rw1613710/?ref_=tturv_perm_264
265,rw0875619,avoid if you have any intelligence,"I took my 5 year old son to see this and regretted every minute. I kept begging him to leave. Unless you like stupid and predictable humor this movie is not for you. The only thing we enjoyed about the film was the popcorn. I think he also enjoyed Santa Claus and the Reindeers. This film was very lame, I knew when I saw the commercials that it would be awful but I had several people tell me it was hilarious, next time I will definitely think for myself.",2003-11-27,"Nov 27, 2003",1.0,41,98,-57,bobs-movies,False,True,89,https://www.imdb.com/title/tt0319343/review/rw0875619/?ref_=tturv_perm_265
266,rw2082595,A holiday holiday,"""Elf"" was yet another Will Ferrel film that I thought from previews was just going to be silly and stupid. I've learned by now to get over my prejudices going into ""Silly and Stupid"" Will Ferrel films. They almost all are that. But somehow they are also funny, and tell stories with more depth than I would ever have imagined. By the way, the same phenomena happens with me regarding Adam Sandler movies. I always think they sound horrible, and I always have far more than my average share of laughs for a comedy. In Elf, its unimaginable that an actor of Ferrel's age can bring off the complete naivety required for a human raised at the North Pole who enters American society as an adult. Yet he brings it off the same way be brings off all of his unlikely sounding roles. Of course, in the process the people he interacts with learn that a little naivety and purity of heart can be a good thing. Yes, there is both slapstick and (mild) gross out comedy, but overall this is a quite entertaining movie, and a suitable Christmas comedy for kids and parents to watch together.",2009-06-18,"Jun 18, 2009",,1,2,-1,VetteRanger,False,True,197,https://www.imdb.com/title/tt0319343/review/rw2082595/?ref_=tturv_perm_266
